id,question,skill,choice1,choice2,choice3,choice4,correct_choice,explanation1,explanation2,explanation3,explanation4,category,status
18674,Who was the first king of Israel?,medium,Saul,David,Solomon,Joshua,1,Saul was anointed as the first king of Israel by the prophet Samuel.,"David was the second king of Israel, chosen by God after Saul's disobedience.","Solomon was the third king of Israel, succeeding his father David.",Joshua was a military leader and one of the twelve spies sent by Moses to scout out the land of Canaan.,Old Testament Characters,draft
18675,What was the name of the first man created by God according to the Old Testament?,medium,David,Adam,Moses,Abraham,2,"David was a king in Israel and a prominent figure in the Bible, but he was not the first man created by God.","Adam was the first man created by God, according to the Old Testament. He was placed in the Garden of Eden and given the command to tend to it.","Moses was a great leader in Israel who received the Ten Commandments from God, but he was not the first man created by God.","Abraham was a faithful servant of God and considered the father of many nations, but he was not the first man created by God.",Old Testament Characters,draft
18676,Which Old Testament character killed a lion with his bare hands?,medium,David,Samson,Moses,Saul,2,David slayed Goliath with a stone and sling.,"Samson was a man of incredible strength. On one occasion, he killed a lion with his bare hands.",Moses led the Israelites out of Egypt and received the Ten Commandments from God.,"Saul was the first king of Israel, chosen by God but ultimately rejected due to his disobedience.",Old Testament Characters,Draft
18677,Who was the father of King David?,medium,Isaiah,Solomon,Jesse,Samuel,3,"Isaiah was a prophet, not the father of David.","Solomon was David's son, not his father.",Jesse was the father of David.,"Samuel was a prophet who anointed David as king, but he was not his father.",Old Testament Characters,draft
18678,Who was the wife of Isaac and the mother of Jacob and Esau?,medium,Rebecca,Leah,Sarah,Rachel,1,Rebecca was the wife of Isaac and the mother of Jacob and Esau.,Leah was one of the wives of Jacob and the mother of several of his sons.,Sarah was the wife of Abraham and the mother of Isaac.,"Rachel was one of the wives of Jacob, and the mother of Joseph and Benjamin.",Old Testament Characters,draft
18679,Who was the prophet who was swallowed by a great fish?,medium,Jonah,Elijah,Elisha,Isaiah,1,"Jonah was commanded by God to go to Nineveh and preach to the people there, but he rebelled and went in the opposite direction. God sent a great fish to swallow him, and Jonah repented and finally preached to Nineveh as God had commanded.",Elijah was a prophet who confronted the idolatry of the Israelites and challenged the prophets of the false god Baal.,"Elisha was a prophet who succeeded Elijah and performed many miracles, including healing the sick and raising the dead.",Isaiah was a prophet who lived in the southern kingdom of Judah. He prophesied about the coming of the Messiah and the eventual salvation of Israel.,Old Testament Characters,draft
18680,Which Old Testament character killed an Egyptian and had to flee to Midian?,medium,Moses,David,Solomon,Joseph,1,"Moses was born in Egypt and was adopted by Pharaoh's daughter. When he saw an Egyptian beating a Hebrew, he killed the Egyptian and had to flee to Midian to escape punishment.",David was a king of Israel who is known for slaying Goliath and establishing Jerusalem as the capital city.,Solomon was a king of Israel who was known for his wisdom and wealth. He built the First Temple in Jerusalem.,Joseph was a son of Jacob who was sold into slavery by his brothers. He became a powerful ruler in Egypt and saved his family from famine.,Old Testament Characters,draft
18681,Who betrayed Jesus with a kiss in the Garden of Gethsemane?,medium,Matthew,Mark,Luke,Judas,4,Matthew is one of Jesus' disciples.,Mark is one of Jesus' disciples.,Luke is one of Jesus' disciples.,"Judas betrayed Jesus with a kiss, leading to his arrest and eventual crucifixion.",New Testament Characters,draft
18682,Who was the disciple that betrayed Jesus Christ?,medium,John,James,Judas,Paul,3,"John was one of the twelve apostles of Jesus, but he was not the one who betrayed Jesus.","James was also one of the twelve apostles of Jesus, but he was not the one who betrayed Jesus either.",Judas Iscariot was one of the twelve apostles of Jesus and he betrayed Jesus by identifying him to the soldiers with a kiss.,"Paul, also known as Saul, was not one of the twelve apostles of Jesus and he did not betray Jesus.",New Testament Characters,draft
18683,Who betrayed Jesus Christ and handed him over to the Roman authorities?,medium,Peter,Judas Iscariot,John,Andrew,2,"Peter was one of the twelve apostles of Jesus Christ, but he never betrayed him.","Judas Iscariot was one of the twelve apostles of Jesus Christ, but he betrayed him to the Roman authorities for thirty pieces of silver.","John was one of the twelve apostles of Jesus Christ, but he never betrayed him.","Andrew was one of the twelve apostles of Jesus Christ, but he never betrayed him.",New Testament Characters,draft
18684,Who was the apostle that betrayed Jesus Christ?,medium,Andrew,Judas Iscariot,James,Matthew,2,"Andrew was one of the twelve apostles, but he did not betray Jesus.",Judas Iscariot was one of Jesus' twelve apostles who famously betrayed him to the authorities for thirty pieces of silver.,"James was one of the twelve apostles, but he did not betray Jesus.","Matthew was one of the twelve apostles, but he did not betray Jesus.",New Testament Characters,draft
18685,Which New Testament character is known for being a tax collector before becoming an apostle?,medium,Matthew,Luke,Mark,John,1,"Matthew, originally known as Levi, was a tax collector before Jesus called him to become a disciple.",Luke was a physician and author of the Gospel of Luke and the Book of Acts.,Mark was a companion of the apostle Paul and author of the Gospel of Mark.,"John was a disciple of Jesus and author of the Gospel of John, as well as several letters.",New Testament Characters,draft
18686,Who was the first son of Adam and Eve?,medium,Cain,Abel,Seth,Enoch,1,Cain was the first son of Adam and Eve mentioned in the Old Testament.,Abel was the second son of Adam and Eve.,Seth was the third son of Adam and Eve.,"Enoch was the son of Jared and the father of Methuselah, but he was not the son of Adam and Eve.",Old Testament Characters,draft
18687,Which Old Testament character was known for his dreams and ability to interpret them?,medium,Daniel,Joseph,Moses,David,2,"Daniel was known for his wisdom and ability to interpret dreams, but he lived several hundred years after Joseph.","Joseph was sold into slavery by his jealous brothers, but eventually rose to become a high-ranking official in Egypt and was known for his ability to interpret dreams.","Moses was known for leading the Israelites out of slavery in Egypt and receiving the Ten Commandments from God, but he was not known for his dreams.","David was a king of Israel and known for his military prowess and as a musician, but he was not known for his dreams.",Old Testament Characters,draft
18688,Who was the first prophet in the Bible?,medium,Elijah,Moses,Elisha,Isaiah,2,Elijah was not the first prophet in the Bible.,"Moses was the first prophet in the Bible, according to Deuteronomy 34:10.","Elisha was a prophet, but he wasn't the first in the Bible.","Isaiah was a prophet who lived much later than Moses, so he couldn't be the first prophet in the Bible.",Old Testament Characters,draft
18689,Who betrayed Samson by revealing the secret of his strength?,medium,Delilah,Ruth,Naomi,Hannah,1,Delilah was a Philistine woman who was bribed by the rulers of the Philistine cities to discover the secret of Samson's strength.,Ruth was a Moabite woman who was married to an Israelite named Boaz and became the great-grandmother of King David.,Naomi was the mother-in-law of Ruth and a central character in the Book of Ruth.,"Hannah was the mother of the prophet Samuel, who anointed Saul and David as kings of Israel.",Old Testament Characters,draft
18690,What is the name of the disciple who betrayed Jesus?,medium,John,Thomas,Judas,Peter,3,"John was a disciple of Jesus, but he did not betray him.","Thomas was one of Jesus' disciples, but he did not betray him.",Judas Iscariot was a disciple of Jesus who betrayed him for 30 pieces of silver.,"Peter was a disciple of Jesus, but he did not betray him.",New Testament Characters,draft
18691,Who was the apostle known as 'the doubter' in the New Testament?,medium,John,Thomas,James,Peter,2,John was one of the twelve apostles,Thomas was known for his initial disbelief in Jesus' resurrection,James was another of the twelve apostles,Peter was known for his denial of Jesus three times before the rooster crowed,New Testament Characters,draft
18692,Who was the tax collector that became one of Jesus' apostles?,medium,Luke,Matthew,Mark,John,2,Luke was a physician who wrote one of the Gospels.,Matthew was a tax collector before he became an apostle of Jesus.,Mark was a disciple of Jesus but he was not a tax collector.,John was a fisherman who became one of Jesus' apostles.,New Testament Characters,draft
18693,Who was called the 'Beloved Disciple' in the New Testament?,medium,Matthew,Peter,James,John,4,"Matthew was a disciple, but was not called the Beloved Disciple.","Peter was a disciple, but was not called the Beloved Disciple.","James was a disciple, but was not called the Beloved Disciple.","John was a disciple and he was called the Beloved Disciple. He is believed to have written the Gospel of John, the three epistles of John, and the book of Revelation.",New Testament Characters,draft
18694,Who was the tax collector that became one of Jesus' disciples?,medium,Matthew,Mark,Luke,John,1,"Matthew, also known as Levi, was a tax collector before he became a disciple of Jesus.",Mark was a companion of Peter and wrote one of the gospels.,Luke was a physician and the author of one of the gospels and the book of Acts.,John was a disciple of Jesus and the author of one of the gospels and several letters in the New Testament.,New Testament Characters,draft
18695,What event marks the birth of Jesus Christ and is celebrated on December 25th every year?,medium,Easter,Christmas,Pentecost,All Saints' Day,2,Easter celebrates the resurrection of Jesus Christ.,Christmas celebrates the birth of Jesus Christ on December 25th.,Pentecost celebrates the descent of the Holy Spirit upon the apostles and followers of Jesus Christ.,All Saints' Day is a day when Christians commemorate and honor saints and martyrs.,Key Christian Events,draft
18696,Which disciple of Jesus betrayed him for thirty pieces of silver?,medium,Peter,Andrew,Judas Iscariot,John,3,Peter was one of Jesus' closest and most trusted disciples.,Andrew was the brother of Peter and was also a disciple of Jesus.,Judas Iscariot was a disciple of Jesus who betrayed him to the authorities for thirty pieces of silver.,"John was another of Jesus' trusted disciples, who was present at the crucifixion.",Key Christian Events,draft
18697,What is the significance of the year 33 AD in Christianity?,medium,It is the year when Jesus was born,It is the year when Jesus was crucified and resurrected,It is the year when the Church of Rome was established,It is the year when the first Christian Bible was written,2,Incorrect. Jesus was likely born around 4 BC.,"Correct. According to Christian tradition, Jesus was crucified and resurrected in the year 33 AD.","Incorrect. The Church of Rome was established much later, in the 4th century AD.","Incorrect. The first Christian Bible was composed over several centuries, with the final books being written in the late 1st or early 2nd century AD.",Key Christian Events,draft
18698,What is the name of the event that commemorates the birth of Jesus Christ?,medium,Easter,Christmas,Pentecost,Passover,2,Incorrect. Easter commemorates the resurrection of Jesus Christ.,Correct! Christmas is widely celebrated as the birth of Jesus Christ.,Incorrect. Pentecost commemorates the descent of the Holy Spirit upon the Apostles.,Incorrect. Passover commemorates the liberation of the Israelites from slavery in ancient Egypt.,Key Christian Events,Draft
18699,Which event marks the beginning of the Christian church?,medium,The Great Schism,The Council of Nicaea,The Crucifixion of Jesus,The Pentecost,4,"The Great Schism refers to the split between the Eastern and Western branches of Christianity, which occurred much later.","The Council of Nicaea was important for the development of Christian doctrine, but did not mark the beginning of the church.","The Crucifixion of Jesus was a significant event in Christian history, but it did not mark the beginning of the church.","The Pentecost marks the day when the Holy Spirit descended upon Jesus' disciples, empowering them to spread his message and forming the beginning of the Christian church.",Key Christian Events,draft
18700,Which book of the Bible tells the story of Ruth?,medium,Genesis,Exodus,Ruth,Judges,3,Genesis is the first book of the Bible.,Exodus tells the story of Moses and the Israelites' escape from Egypt.,Ruth tells the story of a Moabite woman who becomes part of the Israelite family through marriage.,"Judges tells the story of the Israelites under their leaders, known as judges.",Books of the Bible,draft
18701,Which book of the Bible contains the story of Esther?,medium,Exodus,Esther,Ezra,Nehemiah,2,Exodus contains the story of Moses and the Israelites' journey out of Egypt.,The book of Esther tells the story of a Jewish woman who becomes queen and saves her people from genocide.,Ezra and Nehemiah tell the story of Israel's return from exile in Babylon.,Nehemiah tells the story of the rebuilding of the walls of Jerusalem after Israel's return from exile.,Books of the Bible,Draft
18702,In which book of the Bible can we read about the story of Samson and Delilah?,medium,Book of Judges,Book of Ruth,Book of Esther,Book of Daniel,1,"The story of Samson and Delilah can be found in the Book of Judges, specifically in chapters 13-16.",The Book of Ruth is about the loyalty and obedience of Ruth to her mother-in-law Naomi.,"The Book of Esther is about the bravery of Esther, a Jewish woman, who became queen of Persia and saved her people from destruction.",The Book of Daniel tells the story of a Jewish man named Daniel who was taken captive by the Babylonians and served in the court of King Nebuchadnezzar.,Books of the Bible,draft
18703,In which book of the Bible did God tell Moses the Ten Commandments?,medium,Exodus,Deuteronomy,Leviticus,Genesis,1,Exodus 20:1-17 records the Ten Commandments that God spoke to Moses on Mount Sinai.,Deuteronomy contains the retelling of the commandments to the new generation of Israelites who were about to enter the Promised Land.,Leviticus describes the regulations and procedures for worship and sacrifice in the tabernacle.,Genesis is the first book of the Bible that tells the story of creation and the origins of humanity.,Books of the Bible,draft
18704,"Which book of the Bible is a letter written by the apostle Paul to Philemon, urging him to forgive his runaway slave, Onesimus?",medium,Titus,1 Timothy,2 Timothy,Philemon,4,"The book of Titus is a letter written by the apostle Paul to Titus, a Greek Christian leader.","The book of 1 Timothy is a letter written by the apostle Paul to his younger colleague, Timothy, whom he had left to lead the Christian church in Ephesus.","The book of 2 Timothy is a letter written by Paul to Timothy, his beloved son and faithful disciple.","The book of Philemon is a personal letter written by Paul to his friend Philemon, urging him to forgive his runaway slave Onesimus and accept him back as a brother in Christ.",Books of the Bible,draft
18705,"In the parable of the Good Samaritan, who were the two people who walked past the man that was beaten and robbed?",medium,A priest and a Levite,A Pharisee and a scribe,A rich man and a tax collector,A Roman soldier and a merchant,1,"The parable of the Good Samaritan tells the story of a man who was beaten and robbed, left on the side of the road. The first two people to pass him were a priest and a Levite, both of whom chose to ignore him.","The Pharisees and scribes were often at odds with Jesus and his teachings, but they are not mentioned in the parable of the Good Samaritan.",The rich man and tax collector are not mentioned in the parable of the Good Samaritan.,The Roman soldier and merchant are not mentioned in the parable of the Good Samaritan.,Parables of Jesus,Draft
18706,What is the lesson taught in the Parable of the Talents?,medium,To use your talents to pursue your own interests.,To hide your talents away to avoid criticism.,To use your talents to serve others and glorify God.,To sell your talents to make a profit.,3,This choice goes against the key message of the parable.,This choice demonstrates fear and a lack of faith.,"This choice aligns with the parable's message to use our abilities to serve God and others, and not just for our own benefit.",This choice goes against the key message of the parable.,Parables of Jesus,draft
18707,What is the meaning of the Parable of the Prodigal Son?,medium,It's about a father who loves his two sons equally,It's about a son who wastes his inheritance and repents,It's about a son who manipulates his father to get what he wants,It's about a father who disowns his son for being disobedient,2,"While the Parable of the Prodigal Son does involve a father and two sons, the focus is primarily on the younger son who squanders his inheritance and comes to his senses after hitting rock bottom.","Correct! The Parable of the Prodigal Son teaches about God's mercy and forgiveness, even for those who have made grave mistakes.","This is not the correct answer. The younger son in the parable does take advantage of his father's generosity, but the story is not a lesson on manipulation.","No, the father in the story does not disown his son. In fact, he welcomes him back with open arms and celebrates his return.",Parables of Jesus,draft
18708,"In the parable of the sower, what does the seed that falls on the thorny ground represent?",medium,The people who are easily influenced by false teachings.,The people who hear the word of God but do not understand it.,The people who receive the word of God but do not bear fruit.,The people who hear the word of God but are choked by the cares and riches of this world.,4,"This choice is incorrect because it relates to the sower who sows the seed, not the seed itself.","This choice refers to the seed that falls on the hard ground, not the thorny ground.",This choice refers to the seed that falls on the good soil and produces fruit.,Correct! The Bible describes this as the seed that is choked by the cares and riches of this world and does not produce fruit.,Parables of Jesus,draft
18709,What is the message of the Parable of the Good Samaritan?,medium,There is no such thing as a good Samaritan,Everyone in need should be helped regardless of race or religion,Samaritans are bad people,Only help those who are in your own community and faith,2,This choice is incorrect because there is such a thing as a good Samaritan as evidenced by the parable,"This choice is the correct answer because the parable teaches us that we should show compassion to everyone, regardless of race or religion",This choice is incorrect because the Samaritan in the parable demonstrated kindness,This choice is incorrect because helping only those in your community and faith goes against the message of the parable,Parables of Jesus,draft
18710,What miracle did Jesus perform for his disciples in the Sea of Galilee?,medium,He turned water into wine,"He fed 5,000 people with five loaves and two fish",He raised Lazarus from the dead,He walked on water,4,"This miracle took place at the wedding in Cana, not in the Sea of Galilee.","This miracle also took place on land, not in the Sea of Galilee.","This miracle took place in Bethany, not in the Sea of Galilee.","This is the correct answer. Jesus walked on water in the Sea of Galilee, showing his divine power and the trust his disciples had in him.",Bible Miracles,draft
18711,"In what way did Jesus miraculously feed 5,000 people?",medium,He multiplied seven loaves of bread and a few small fish,He turned water into wine and the crowd drank and became satisfied,He called down manna from heaven to feed the people,He did not feed them miraculously but instead directed them to a town where they could buy food,1,Jesus multiplied the fishes and bread to feed the five thousand people who had gathered to listen to his teachings.,"This is not correct. Although Jesus turned water into wine at a wedding in Cana, this miracle had nothing to do with feeding 5,000 people.","This is not correct. Although manna from heaven was a miracle recorded in the Bible, it had nothing to do with feeding the 5,000 people.","This is not correct. Jesus performed a miraculous feeding where 5,000 people were fed by only 5 loaves of bread and 2 fish.",Bible Miracles,draft
18712,In which miracle did Jesus turn water into wine?,medium,Cleansing a Leper,Healing a Paralyzed Man,Feeding the 5000,Turning Water into Wine,4,Cleansing a Leper was a miracle where Jesus healed a person who had leprosy.,Healing a Paralyzed Man was a miracle where Jesus healed a person who was paralyzed and couldn't walk.,Feeding the 5000 was a miracle where Jesus fed a large group of people with just a few loaves of bread and fish.,Turning Water into Wine was a miracle where Jesus turned water into wine at a wedding in Cana.,Bible Miracles,Draft
18713,Which miracle did Jesus perform for a blind man in Bethsaida?,medium,Healing the man's eyes with his saliva,Touching the man's eyes with his hands,Rubbing mud in the man's eyes,Asking the man to wash his eyes in the pool of Siloam,4,There is no account of Jesus healing a blind man with his saliva.,"Though touching the eyes of a blind man is a common method used in healing during that time, it is not the miracle that was performed in Bethsaida.",Rubbing mud was part of a miracle Jesus performed for a different blind man in John 9.,"According to Mark 8:22-26, when Jesus laid his hands on the man's eyes and asked him to look up, the man's sight was restored partly, and Jesus had to touch his eyes again before he could see clearly. Jesus then instructed the man to go wash his eyes in the pool of Siloam.",Bible Miracles,draft
18714,In which miracle did Jesus heal a man born blind?,medium,"Feeding of the 5,000",Turning water into wine,Healing of the lepers,Healing the blind man of Bethsaida,4,"This is incorrect. The feeding of the 5,000 miracle is when Jesus feeds 5,000 people with only five loaves of bread and two fish.",This is incorrect. The turning water into wine miracle is when Jesus changes water into wine at a wedding in Cana.,This is incorrect. The healing of the lepers miracle is when Jesus healed 10 lepers but only one thanked and praised God.,This is correct. The healing the blind man of Bethsaida is when Jesus heals a man born blind. (John 9:1-41),Bible Miracles,draft
18715,What does the dove symbolize in Christian art and literature?,medium,The Holy Spirit,Humility,Sacrifice,Love,1,"In Christian art and literature, the dove is a symbol of the Holy Spirit, which descended upon Jesus during his baptism in the Jordan River.","While humility is an important Christian value, it is not typically symbolized by a dove in Christian art and literature.","Sacrifice is an important Christian concept, but it is not typically symbolized by a dove in Christian art and literature.","Love is an important aspect of Christian faith, but it is not typically symbolized by a dove in Christian art and literature.",Christian Symbols,draft
18716,What do the three points of the Trinity symbol represent?,medium,"The Father, the Son, and the Holy Spirit","The Holy Spirit, the crown, and the cross","The Father, the Son, and the Bible","The Bible, the Holy Spirit, and the cross",1,"The Trinity symbol, also known as the Triquetra, represents the Father, the Son, and the Holy Spirit in Christian theology.","The crown, the cross, and the Holy Spirit are all important symbols in Christianity, but they are not the three points of the Trinity symbol.","While the Bible is an important symbol in Christianity, it is not represented in the three points of the Trinity symbol.","The cross and the Holy Spirit are both important symbols in Christianity, but they are not part of the three points of the Trinity symbol.",Christian Symbols,Draft
18717,What does the Christian symbol of the dove represent?,medium,Eternal life,Creation,The Holy Spirit,The Resurrection,3,Incorrect. Eternal life is often represented by other symbols like the vine or the fish.,Incorrect. Creation is often represented by the globe or the world surrounded by water.,"Correct! The dove is commonly seen as a symbol of the Holy Spirit, as it is believed to have descended from heaven at the baptism of Jesus.",Incorrect. The Resurrection is often represented by the butterfly or phoenix.,Christian Symbols,draft
18718,What is the significance of the cross in Christianity?,medium,It represents the power of the Roman Empire.,It symbolizes the violent death of Jesus on the cross.,It represents the ancient Egyptian ankh symbol.,It is a symbol of good luck and prosperity.,2,Incorrect. The cross has no connection with the power of the Roman Empire.,Correct. The cross is a symbol of the violent death of Jesus and his sacrifice for the sins of humanity.,Incorrect. The cross has no connection with the ancient Egyptian ankh symbol.,Incorrect. The cross is not a symbol of good luck or prosperity.,Christian Symbols,draft
