id,question,skill,choice1,choice2,choice3,choice4,correct_choice,explanation1,explanation2,explanation3,explanation4,category,status
18719,What does the Ichthus symbol represent in Christianity?,medium,The Holy Trinity,The resurrection of Jesus,The five wounds of Christ,The significance of fish in the Bible,4,This is not the correct representation of the Ichthus symbol.,This is not the correct representation of the Ichthus symbol.,This is not the correct representation of the Ichthus symbol.,"The Ichthus symbol, also known as the fish symbol, represents the significance of fish in the Bible. Jesus' disciples were fishermen and he called them to be 'fishers of men'. Additionally, Jesus performed multiple miracles involving fish, such as feeding a multitude of people with loaves of bread and a few fishes. This symbol can be found on bumper stickers and jewelry as a way of identifying oneself as a Christian. ",Christian Symbols,draft
18720,What was the city built by King Solomon in the hill country of Judah?,medium,Bethel,Hebron,Ziklag,Debir,4,Bethel was a city in the land of Benjamin.,Hebron was an ancient city south of Jerusalem.,Ziklag was a city given to David by King Achish of Gath.,"Debir was a city in the hill country of Judah, which was rebuilt by King Solomon as a fortified city.",Biblical Geography,draft
18721,What city was known as the city of David and the capital of Israel during his reign?,medium,Jericho,Bethlehem,Hebron,Jerusalem,4,Jericho is an ancient city in the Jordan River Valley.,Bethlehem is where Jesus was born.,"Hebron was an important city in ancient Israel, but it was never the capital.",Jerusalem was the city of David and the capital of Israel during his reign. It is still an important city in Israel today.,Biblical Geography,draft
18722,Which river did the prophet Elisha ask the Syrian military commander to wash in to be healed of his leprosy?,medium,Nile River,Jordan River,Euphrates River,Tigris River,2,Incorrect. The Nile River is in Egypt and is not mentioned in the story of Elisha and the Syrian commander.,"Correct! Elisha instructed Naaman, the Syrian commander, to go to the Jordan River and wash himself seven times in it in order to be cleansed of his leprosy, which he did and was healed.","Incorrect. While the Euphrates is mentioned in the Bible, it is not the river referred to in this story.","Incorrect. While the Tigris is mentioned in the Bible, it is not the river referred to in this story.",Biblical Geography,draft
18723,What body of water is located at the eastern edge of the Promised Land in the Bible?,medium,Dead Sea,Mediterranean Sea,Red Sea,Sea of Galilee,1,"Correct! The Dead Sea is located at the eastern edge of the Promised Land, also known as the Jordan Rift Valley.",Incorrect. The Mediterranean Sea is located to the west of the Promised Land.,Incorrect. The Red Sea is located to the south of the Promised Land.,Incorrect. The Sea of Galilee is located in the northern part of the Promised Land.,Biblical Geography,draft
18724,Which river was the location of Jesus' baptism?,medium,Jordan River,Nile River,Euphrates River,Tigris River,1,The Jordan River is the river where John the Baptist was baptizing and where Jesus was baptized.,The Nile River is a major river in Egypt.,The Euphrates River is a river in Mesopotamia.,The Tigris River is a river in Mesopotamia.,Biblical Geography,draft
18725,Which Christian denomination places a strong emphasis on baptism as a public declaration of one's faith?,medium,Baptist,Methodist,Lutheran,Presbyterian,1,"Correct! Baptists believe that baptism is a symbol of a person's commitment to following Jesus, and should be celebrated publicly.","Incorrect. Although many Methodists do practice baptism, their emphasis is more on recognizing the presence of God's grace in one's life.","Incorrect. Lutherans also place importance on baptism, but not necessarily as a public declaration of faith.","Incorrect. While some Presbyterian denominations do recognize the importance of baptism, it is not a central tenet of their faith.",Christian Denominations,Draft
18726,What is the origin of the Baptist denomination?,medium,England,Germany,Switzerland,Italy,1,The Baptist denomination originated in 17th century England.,"The Baptist denomination originated in 17th century England, not Germany.","The Baptist denomination originated in 17th century England, not Switzerland.","The Baptist denomination originated in 17th century England, not Italy.",Christian Denominations,draft
18727,Which Christian denomination is known for its strict adherence to pacifism and nonviolence?,medium,Lutheranism,Mennonitism,Methodism,Orthodox Christianity,2,"Lutherans believe in the doctrine of 'two kingdoms,' which allows for the use of force in secular affairs.","Mennonites have a longstanding tradition of pacifism and nonviolence, which stems from their belief in following Jesus' example of love and sacrifice.","While Methodists do believe in social justice and peace, they do not have a strict doctrine on pacifism like the Mennonites do.","Orthodox Christianity is a broad term that encompasses many different traditions and practices. While some individual Orthodox Christians may be pacifists, it is not a defining characteristic of the denomination as a whole.",Christian Denominations,draft
18728,Which Christian denomination is known for its emphasis on baptism by immersion?,medium,Methodist,Presbyterian,Lutheran,Baptist,4,The Methodist denomination typically practices infant baptism.,The Presbyterian denomination practices infant baptism as well as baptism of believers.,"The Lutheran denomination practices both infant baptism and baptism of believers, but not necessarily by immersion.",The Baptist denomination places significant emphasis on baptism by immersion as a symbol of repentance and salvation.,Christian Denominations,draft
18729,What is the largest Protestant denomination in the United States?,medium,Methodist,Baptist,Presbyterian,Lutheran,2,"Incorrect, while the Methodist church is relatively large, it is not the largest",Correct! The Baptist denomination has the highest number of adherents among Protestant denominations in the United States,"Incorrect, while the Presbyterian church is relatively large, it is not the largest","Incorrect, while the Lutheran church is relatively large, it is not the largest",Christian Denominations,draft
18730,What is the Christian festival that marks the end of the Lenten season and the beginning of the Easter season?,medium,Christmas,Good Friday,Maundy Thursday,Easter Sunday,4,"Sorry, this is incorrect. Christmas is celebrated to commemorate the birth of Jesus Christ.","Sorry, this is incorrect. Good Friday is observed to commemorate the crucifixion of Jesus Christ.","Sorry, this is incorrect. Maundy Thursday is observed to commemorate the Last Supper of Jesus Christ with his apostles.",Correct! Easter Sunday marks the resurrection of Jesus Christ from the dead.,Christian Festivals,draft
18731,What is the Christian festival that celebrates the resurrection of Jesus Christ?,medium,Christmas,Easter,Pentecost,All Saints' Day,2,Christmas is the Christian festival that celebrates the birth of Jesus Christ.,Easter is the Christian festival that celebrates the resurrection of Jesus Christ.,Pentecost is the Christian festival that celebrates the descent of the Holy Spirit upon the Apostles.,"All Saints' Day is the Christian festival that honors all the saints, known and unknown.",Christian Festivals,draft
18732,What is the Christian festival commemorating the descent of the Holy Ghost upon the apostles?,medium,Easter,Pentecost,Christmas,Epiphany,2,Easter is the celebration of the resurrection of Jesus Christ,Pentecost is the celebration of the descent of the Holy Ghost,Christmas is the celebration of the birth of Jesus Christ,Epiphany is the celebration of the visit of the Magi to the baby Jesus,Christian Festivals,draft
18733,What is the meaning behind Pentecost in Christianity?,medium,Celebration of the resurrection of Jesus Christ,Celebration of the birth of Jesus Christ,Celebration of the arrival of the wise men to visit Jesus Christ,Celebration of the descent of the Holy Spirit upon the apostles,4,Incorrect answer. Easter is the celebration of the resurrection of Jesus Christ.,Incorrect answer. Christmas is the celebration of the birth of Jesus Christ.,Incorrect answer. The Feast of Epiphany is the celebration of the arrival of the wise men to visit Jesus Christ.,"Correct answer. The feast commemorates the descent of the Holy Spirit upon the Apostles and other followers of Jesus Christ, which occurred 50 days after his resurrection.",Christian Festivals,draft
18734,What is the Christian holiday commemorating the descent of the Holy Spirit on the disciples of Jesus?,medium,Easter,Advent,Pentecost,Christmas,3,Easter is a Christian holiday celebrating the resurrection of Jesus from the dead. ,Advent is a Christian season of preparation leading up to Christmas.,Pentecost is a Christian festival commemorating the descent of the Holy Spirit on the disciples of Jesus.,Christmas is a Christian holiday celebrating the birth of Jesus.,Christian Festivals,draft
18735,"In Christian theology, what is the name given to the doctrine of the end of the world and Judgement Day?",medium,Apocalypse,Revelation,Armageddon,Rapture,2,"Although the Apocalypse is a common term used to refer to the end of the world, it is not the official doctrine name.","Revelation, or the Second Coming of Christ, marks the end of the world and the beginning of a new, eternal age.","Armageddon refers to the final conflict between the forces of good and evil, not necessarily the end of the world.","The Rapture refers to the belief in a sudden, miraculous taking of the church with the faithful being transported directly to heaven.",Christian Theology,Draft
18736,What is the concept of atonement in Christian theology?,medium,The practice of confession and repentance to make amends for one's sins,The belief in multiple gods that each have their own domain in the universe,The teaching that God became human in the person of Jesus to sacrifice himself and make amends for humanity's sins,The study of the end of the world and the eventual judgement of humanity,3,"This answer describes the practice of confession and repentance, but not atonement.","This answer describes the belief of polytheism, which has no relation to atonement in Christianity.","This answer is correct. Atonement refers to the belief that God became human in the person of Jesus to sacrifice himself and make amends for humanity's sins, allowing humanity to be reconciled to God.","This answer describes eschatology, which is related to the end of the world, but not to atonement in Christianity.",Christian Theology,draft
18737,"According to the Nicene Creed, which of the following statements about God the Father is true?",medium,He is a created being.,He is the same person as Jesus Christ.,He possesses distinct roles within the Trinity.,He is subordinate to the Holy Spirit.,3,"This statement contradicts Christian orthodoxy, which holds that God the Father is eternal.","This statement contradicts Christian orthodoxy, which holds that God the Father and Jesus Christ are two distinct persons united in the Trinity.","This statement is consistent with the Nicene Creed, which affirms that God the Father possesses a distinct role as the creator of the universe and the source of salvation.","This statement contradicts Christian orthodoxy, which holds that all members of the Trinity are equal in power and authority.",Christian Theology,draft
18738,What is the meaning of the term 'Trinity' in Christian theology?,medium,"The belief in one God in three persons: the Father, the Son, and the Holy Spirit.",The belief in the divinity of Jesus Christ.,The belief that human beings have free will.,The belief that the Bible is the ultimate authority in matters of faith and practice.,1,"The term 'Trinity' refers to the belief in one God in three persons: the Father, the Son, and the Holy Spirit. This is a fundamental doctrine of Christian theology.","The belief in the divinity of Jesus Christ is a separate doctrine in Christian theology, and is not directly related to the concept of the Trinity.","The belief in free will is also an important concept in Christian thought, but it is not directly related to the Trinity.","The belief in the authority of the Bible is another important concept in Christian theology, but it is not directly related to the Trinity.",Christian Theology,draft
18739,What is the significance of the doctrine of the Trinity in Christian theology?,medium,The doctrine of the Trinity is the belief in three separate gods,"The doctrine of the Trinity is the belief that the Father, Son, and Holy Spirit are separate beings",The doctrine of the Trinity is the belief that there is one God in three persons,"The doctrine of the Trinity is the belief in the Father, Son, and Holy Spirit as three manifestations of the same divine being",3,This is not correct as Christianity is a monotheistic religion and only believes in one God.,This is not correct because Christianity teaches that there is only one God.,"This is the correct answer as the doctrine of the Trinity teaches that there is only one God in three persons - the Father, Son, and Holy Spirit.","This statement is close to the truth, but it is better to say that there is one God in three persons rather than the same divine being being manifested in three ways.",Christian Theology,Draft
18740,What is the Moral Argument for the existence of God?,medium,God's existence is necessary for objective moral values and duties.,God's existence is necessary for physical laws to exist.,God's existence is necessary for the universe to exist.,God's existence is necessary for intelligent life to exist.,1,"The Moral Argument states that if God does not exist then objective moral values and duties do not exist, but they do exist, therefore God must exist.",This is not the premise or conclusion of the Moral Argument.,This is not the premise or conclusion of the Moral Argument.,This is not the premise or conclusion of the Moral Argument.,Christian Apologetics,draft
18741,What is the ontological argument for the existence of God?,medium,The argument from fine-tuning,The argument from design,The argument from morality,The argument from being,4,"The argument from fine-tuning points to the fact that the universe's conditions are finely-tuned for life, while the argument from design states that the complexity of the universe proves intelligent design.","The argument from morality asserts that objective morality exists, and it must have been created by a moral lawgiver. ",The ontological argument contends that the very concept of God proves His existence.,"The ontological argument asserts that since we can conceive of the greatest conceivable being, a being that exists in reality must be greater than one that exists only in our minds.",Christian Apologetics,draft
18742,What is the 'Trilemma' argument presented by C.S. Lewis in his book 'Mere Christianity'?,medium,Jesus was a liar and a fraud,Jesus was a lunatic and insane,Jesus was the Son of God,Jesus never really existed,3,This is not the argument presented by C.S. Lewis.,This is not the argument presented by C.S. Lewis.,"Lewis' argument is that Jesus could not have simply been a good moral teacher, and that the only other options are that he was either a liar or a lunatic, or that he was truly the Son of God.",This is not the argument presented by C.S. Lewis.,Christian Apologetics,draft
18743,What is the Kalam Cosmological Argument?,medium,A theological argument for the existence of God based on the idea of cause and effect,A philosophical argument against the existence of God based on the problem of evil,A scientific argument for the existence of extraterrestrial life,An epistemological argument for the reliability of the Bible,1,"The Kalam Cosmological Argument is a philosophical argument for the existence of God that uses the idea of cause and effect. It states that everything that begins to exist has a cause, and since the universe began to exist, it must have had a cause, which is God.","The problem of evil is a philosophical argument against the existence of God, which states that the existence of evil is incompatible with the existence of a good and all-powerful God.",The search for extraterrestrial life is a scientific pursuit that has no bearing on the existence or non-existence of God.,"The reliability of the Bible is an important topic for Christian apologetics, but it is not related to the Kalam Cosmological Argument.",Christian Apologetics,Draft
18744,What is the teleological argument for the existence of God?,medium,"The argument that the universe began to exist, thus it must have a cause",The argument that morality is subjective and requires a moral lawgiver,The argument that certain features of the universe suggest it was designed by an intelligent creator,The argument that personal experience of God's existence is evidence of His existence,3,This is the cosmological argument.,This is the moral argument.,This is the teleological argument.,This is the argument from religious experience.,Christian Apologetics,Draft
18745,What is the name of the traditional prayer of confession in Christian liturgy?,medium,Our Father,Hail Mary,Gloria Patri,Kyrie Eleison,4,The Our Father is a prayer Jesus taught his disciples.,The Hail Mary is a prayer asking for the intercession of the Virgin Mary.,"The Gloria Patri, also known as the Glory Be, is a prayer of praise to the Trinity.","Kyrie Eleison is Greek for 'Lord, have mercy' and is often used as a prayer of confession in Christian liturgy.",Christian Worship and Liturgy,Draft
18746,What is the meaning of the term 'liturgy' in the context of Christian worship? ,medium,A prayer recited by the priest during the Eucharistic celebration,A type of music traditionally sung during the Christmas season,The collection of sacred writings in the Old and New Testaments,The established form or order of public worship,4,This choice describes a prayer called the Eucharistic Prayer,This choice describes Christmas Carols,This choice describes the Bible,This choice correctly defines the term 'liturgy' as the established form or order of public worship,Christian Worship and Liturgy,Draft
18747,What is the name of the liturgical book used by Roman Catholics containing instructions for the celebration of Mass and other liturgies?,medium,Lectionary,Breviary,Missal,Ritual,3,The Lectionary is the book containing the readings for Mass.,The Breviary is the Catholic liturgical book containing the Liturgy of the Hours.,The Missal is the Catholic liturgical book containing instructions for the celebration of Mass.,The Ritual is a Catholic liturgical book containing instructions for the administration of the sacraments and other rituals.,Christian Worship and Liturgy,draft
18748,What is the name of the liturgical book that contains the chants and prayers for the seven celebrations of the Catholic Church sacraments?,medium,Gradual,Sacramentary,Lectionary,Liturgy of the Hours,2,The Gradual contains the propers for the Mass.,The Sacramentary contains the chants and prayers for the seven celebrations of the Catholic Church sacraments.,The Lectionary contains the scripture readings for the Mass.,The Liturgy of the Hours contains the prayers for each of the seven daily hours of the day.,Christian Worship and Liturgy,draft
18749,Which of the following is not a liturgical color used in Christian worship?,medium,Green,Red,Gold,Purple,3,Green is used in Ordinary Time after Epiphany and after Pentecost.,"Red is used on Pentecost, on the feast of the Holy Cross, and on the feasts of apostles and martyrs.","Gold is not a liturgical color, though it is sometimes used as an accent color. It can represent the glory and majesty of God.","Purple is used in Advent and Lent to represent prayer, penance, and preparation.",Christian Worship and Liturgy,draft
18750,"According to the Bible, what is the most important commandment given by Jesus Christ?",medium,Love your neighbor as yourself,Honor your father and mother,Do not bear false witness,Do not steal,1,"This commandment is mentioned several times in the New Testament, including Matthew 22:37-40 and Mark 12:28-34.","While honoring one's parents is a commandment in the Old Testament, it is not the most important commandment according to Jesus in the New Testament.","While speaking the truth and avoiding lies is important, it is not the most important commandment according to Jesus in the New Testament.","While not stealing is important, it is not the most important commandment according to Jesus in the New Testament.",Christian Practices,Draft
18751,What is the significance of confession of sins in the Christian faith?,medium,It removes the sinful nature of a person.,It is a way to earn forgiveness from God.,It helps a person take responsibility for their actions.,It is not necessary for salvation.,3,Confession of sins does not remove the sinful nature as it is a continuous process.,"Forgiveness cannot be earned, but is received through grace by faith in Jesus Christ.",Confession helps a person take responsibility for their actions and come to terms with their mistakes.,Confession is an important part of Christian faith and has been practiced since biblical times.,Christian Practices,draft
18752,What is the purpose of fasting in Christianity?,medium,To prove to God your devotion,To punish yourself for your sins,To deny the desires of the flesh,To earn forgiveness from God,3,Fasting is not meant to prove one's devotion to God.,Fasting is not a form of punishment for sin.,"By denying the desires of the flesh, Christians can focus more on their spiritual life and draw closer to God.","Fasting does not earn forgiveness from God, as salvation is based on faith alone.",Christian Practices,draft
18753,What is fasting in Christianity?,medium,Eating a restricted diet,Going without food or certain types of food for a specific period of time,Going without water for a specific period of time,Going without sleep for a specific period of time,2,"This is not correct. Fasting is not necessarily about eating less food, but rather about abstaining from food altogether or certain types of food.",Correct! Fasting is a practice commonly associated with Christianity that involves going without food or certain types of food for a specific period of time.,"This is not correct. While some may include abstaining from water in their fasting practice, going without water for an extended period of time can be dangerous and is not recommended.",This is not correct. Going without sleep for extended periods of time is not a recommended practice in Christianity or any other religion.,Christian Practices,draft
18754,What is the significance of the sacrament of Holy Communion?,medium,It is a symbolic act of remembrance of Jesus' sacrifice on the cross.,It is a way to earn forgiveness for sins.,It is a means of experiencing the physical presence of Jesus.,It is a form of idol worship.,1,"Holy Communion is a symbolic act of remembrance of Jesus' sacrifice on the cross, as he instructed his disciples to eat bread and drink wine in memory of him.","Holy Communion is not a means of earning forgiveness for sins, as forgiveness comes only through faith in Jesus Christ and repentance.","Although some Christians believe in the real presence of Jesus in the sacrament, most see it as a spiritual rather than physical experience.","Holy Communion is not a form of idol worship, as it is not an object or person being worshipped but rather a remembrance of Jesus' sacrifice.",Christian Practices,Draft
18755,What is the most popular Bible verse?,medium,"For God so loved the world that he gave his only begotten Son, that whoever believes in him shall not perish but have eternal life.","Do not be anxious about anything, but in every situation, by prayer and petition, with thanksgiving, present your requests to God.","Trust in the Lord with all your heart and lean not on your own understanding; in all your ways submit to him, and he will make your paths straight.","The Lord is my shepherd, I lack nothing. He makes me lie down in green pastures, he leads me beside quiet waters, he refreshes my soul.",1,John 3:16 is the most well-known and widely quoted Bible verse.,Philippians 4:6 is a popular verse about overcoming anxiety and relying on God.,Proverbs 3:5-6 encourages us to trust in God and follow His guidance.,Psalm 23 is a famous psalm about the Lord's provision and care for His people.,Popular Bible Verses,Draft
18756,Which popular Bible verse talks about love?,medium,"For God so loved the world, that he gave his only Son, that whoever believes in him should not perish but have eternal life. (John 3:16)","Beloved, let us love one another, for love is from God, and whoever loves has been born of God and knows God. (1 John 4:7)","So now faith, hope, and love abide, these three; but the greatest of these is love. (1 Corinthians 13:13)",Love is patient and kind; love does not envy or boast; it is not arrogant or rude. It does not insist on its own way; it is not irritable or resentful. (1 Corinthians 13:4-5),2,John 3:16 talks about God's love for the world and how he sent his only son to save us.,1 John 4:7 emphasizes that love comes from God and encourages believers to love one another.,"1 Corinthians 13:13 mentions faith, hope, and love as three important virtues, with love being the greatest.","1 Corinthians 13:4-5 describes what love should look like in action, with qualities such as patience and kindness.",Popular Bible Verses,draft
