id,question,skill,choice1,choice2,choice3,choice4,correct_choice,explanation1,explanation2,explanation3,explanation4,category,status
18757,"Which popular Bible verse says, ""For God so loved the world that he gave his only begotten Son, that whosoever believeth in him should not perish, but have everlasting life?""",medium,John 8:32,John 1:1,John 3:16,John 14:6,3,This verse is not found in John 8:32.,This verse is not found in John 1:1.,This is the correct answer. This verse is found in John 3:16 and is one of the most well-known verses in the Bible.,This verse is not found in John 14:6.,Popular Bible Verses,draft
18758,"Which popular Bible verse says, 'For God so loved the world that he gave his one and only Son, that whoever believes in him shall not perish but have eternal life'?",medium,John 3:16,Psalm 23:1,Romans 8:28,1 Corinthians 13:13,1,"'For God so loved the world that he gave his one and only Son, that whoever believes in him shall not perish but have eternal life' is a popular Bible verse from John 3:16.","Psalm 23:1 says, 'The Lord is my shepherd, I lack nothing.'","Romans 8:28 says, 'And we know that in all things God works for the good of those who love him, who have been called according to his purpose.'","1 Corinthians 13:13 says, 'And now these three remain: faith, hope and love. But the greatest of these is love.'",Popular Bible Verses,draft
18759,What is the most popular verse in the Bible?,medium,Genesis 1:1 - In the beginning God created the heavens and the earth.,"John 3:16 - For God so loved the world that he gave his one and only Son, that whoever believes in him shall not perish but have eternal life.","Psalm 23:1 - The Lord is my shepherd, I lack nothing.",Philippians 4:13 - I can do all this through him who gives me strength.,2,This verse is the first verse in the Bible and describes the creation of the universe.,This is the most famous and oft-quoted Bible verse that highlights the nature and mission of God.,This is a powerful and comforting psalm that is often read at funerals.,This verse emphasizes the believer's strength coming from God and relying on Him for all things.,Popular Bible Verses,draft
18760,What are the similarities between Jesus in Christianity and Islam?,medium,Both agree that Jesus was a prophet,Both believe that Jesus was born of a virgin,Both affirm that Jesus performed miracles,All of the above,4,"Muslims consider Jesus to be a prophet sent by God, but not divine.",Both religions agree that Jesus was born of the Virgin Mary.,"Both affirm that Jesus performed many miracles, including healing the sick and raising the dead.",All of the above are similarities between Jesus in Christianity and Islam.,Gospel Sharing with Muslims,draft
18761,What is the most effective way to initiate a Gospel conversation with a Muslim?,medium,Start with the similarities between Islam and Christianity,Ask them about their background and culture,Share your personal testimony,Use apologetics to highlight the differences between Islam and Christianity,2,"This approach may work with some Muslims, but it can also cause confusion or defensiveness.",Showing interest in their personal lives and culture can help build rapport and establish common ground.,"Sharing your personal testimony can be a powerful way to connect with another person, but it may not always be the most effective starting point with Muslims.",Focusing on differences can create tension and hinder the conversation. It is better to try to find common ground first.,Gospel Sharing with Muslims,draft
18762,What is the name of the Muslim holy book?,medium,The Hadith,The Quran,The Bible,The Tanakh,2,The Hadith is a collection of sayings and actions of the Prophet Muhammad.,The Quran is the holy book of Islam that contains the teachings of Allah as revealed to the Prophet Muhammad.,The Bible is the holy book of Christians and Jews that consists of the Old and New Testaments.,"The Tanakh is the Hebrew Bible, which consists of the Torah, Prophets, and Writings.",Gospel Sharing with Muslims,draft
18763,What is one major difference between the Islamic and Christian view of Jesus Christ?,medium,"Muslims believe Jesus is a prophet, while Christians believe he is the Son of God","Muslims believe Jesus is the Son of God, while Christians believe he is a prophet",Both Muslim and Christian faiths view Jesus in the same light,Muslims and Christians view Jesus as an important historical figure only,1,"Muslims consider Jesus to be a prophet, while Christians believe that he is the Son of God who died for the sins of the world, according to their faith.",Muslims do not believe that Jesus is the Son of God.,This is not true; Muslims and Christians have very different beliefs about Jesus Christ.,Both faiths place great significance on Jesus Christ as a spiritual figure rather than just a historical one.,Gospel Sharing with Muslims,draft
18764,Which of the following is not an effective way to share the Gospel with Muslims?,medium,Using the Quran to explain the teachings of Jesus,Explaining salvation through the sacrifice of Jesus on the cross,Comparing the similarities between Christianity and Islam,Confronting Muslims with the differences between Islam and Christianity,4,Using the Quran to explain the teachings of Jesus can be a helpful method in sharing the Gospel with Muslims as it shows the biblical teachings of Jesus are also mentioned in the Quran.,Explaining salvation through the sacrifice of Jesus on the cross is a key doctrine of the Christian faith and can be used to share the Gospel with Muslims who may be unfamiliar with this concept.,Comparing the similarities between Christianity and Islam can be a helpful way to show that the two religions have some common ground.,"Confronting Muslims with the differences between Islam and Christianity can often be counterproductive as it may create a sense of hostility and cause the person to become defensive. It's important to approach Gospel sharing with Muslims in a respectful and loving manner, building friendship and showing that Jesus' message of love and redemption is for everyone.",Gospel Sharing with Muslims,draft
