"CATEGORY","QUESTION","ANSWER","LINK"
"Atheist","What led you to the conclusion that there is no God?","Assuming the non-Christian is open to conversation about Christianity, you could:------1. Share why you personally believe in Jesus as the Savior.------2. Ask the non-Christian if they have any experiences or beliefs that have led them to their current view of God or religion.------3. Explain the Christian concept of sin and how it separates us from God.------4. Share the Gospel message of Jesus' sacrificial death and resurrection that provides a way for us to be reconciled with God.------5. Ask the non-Christian if they have any questions or concerns about Christianity or the Gospel.------6. Respectfully address any objections the non-Christian may have about the Gospel or biblical teachings.------7. Pray with the non-Christian and offer to continue the conversation or provide resources for further exploration of the faith.","https://www.amazon.com/God-Delusion-Richard-Dawkins/dp/0618918248."
"Atheist","Do you think there is any possibility of a higher power existing?","Assuming that the non-Christian did not respond positively to the initial question posed, the Christian could continue the conversation with the following steps:------1. Listen: It is important to listen to the non-Christian's perspective and understand why they may hold certain beliefs or have objections to Christianity. This creates a respectful and welcoming environment for further discussion.------2. Share Your Personal Experience: Share with the non-Christian your personal experience with Christianity and how it has positively impacted your life. This demonstrates the reality and relevance of the gospel in your life.------3. Offer Evidence: Share any evidences or arguments that support Christianity, whether it's historical evidence for the resurrection, scientific evidence for the complexity and design of the universe, or philosophical arguments for the existence of God. However, be aware of the non-Christian's objections and disagreements to avoid being too confrontational.------4. Share the Gospel: Once the non-Christian has a better understanding of Christianity, share the gospel message clearly and concisely. Use passages from the Bible and personal anecdotes to illustrate the love and grace of God.------5. Leave the Door Open: The ultimate goal is not to convert the non-Christian on the spot but to provide them with the necessary information to make an informed decision about Christianity. Leave the door open for further conversations and answer any follow-up questions they may have.","https://www.reasonablefaith.org/writings/scholarly-writings/existence-nature-of-god/the-existence-of-god/"
"Atheist","How do you find meaning and purpose in life?","As a Christian Apologetics Expert, I would recommend following up with questions that help the non-Christian recognize their need for a savior and the hope that Jesus can offer. Here are a few options:------1. Can you tell me about a time in your life when you experienced a deep longing for something more or a sense of dissatisfaction with your current circumstances?---2. When you think about the world and all of its problems, what gives you hope for the future?---3. Have you ever considered what happens after we die? If so, what do you believe happens?------Based on their answers, you can then share the gospel and explain how Jesus offers forgiveness, healing, and hope for their life both now and in eternity. It's important to listen to their responses with empathy and understanding, rather than jumping to conclusions or dismissing their worldview. By building a relationship of trust and genuinely caring for the other person, you can help them see the relevance and beauty of the gospel message.","https://ggsc.berkeley.edu/what_we_do/major_initiatives/expanding_gratitude/program_components/find_meaning_and_purpose_in_life"
"Atheist","Have you ever considered the historical evidence for Jesus?","One way to follow on in the conversation and share the gospel is to approach it through relationship-building and empathy. Ask questions about the non-Christian's life experiences, struggles, and values. Listening to their responses with genuine interest can help build trust and create a space for meaningful dialogue.------Once a relationship has been established, look for opportunities to share your own experiences and testimonies of how your faith in Christ has impacted your life. You can also share biblical stories and principles that align with the non-Christian's values and concerns.------It's important to remember that ultimately, it's the Holy Spirit who convicts hearts and brings people to faith in Christ. Therefore, be patient and respectful throughout the conversation, and acknowledge that the decision to follow Christ is ultimately up to the individual.","https://www.reasonablefaith.org/writings/question-answer/jesus-of-nazareth/historical-evidence-of-jesus/"
"Atheist","What would it take for you to believe in God?","One approach could be to ask the non-Christian about their worldview and beliefs. This can help to understand their perspective and provide an opportunity to share the unique aspects of the Christian faith that may resonate with them. For example, the concept of unconditional love, forgiveness, and salvation through faith in Jesus Christ.------Another approach could be to address common misconceptions or objections to Christianity that the non-Christian may have. This can be done through providing evidence and reasoning, whether it be from personal experience, historical events, or scientific discoveries.------Ultimately, the goal is to communicate the Gospel in a way that is relevant and meaningful to the non-Christian, while also maintaining respect for their beliefs and perspective. Prayer and genuine love for the individual can also play a crucial role in the conversation.","https://www.crosswalk.com/faith/spiritual-life/what-would-it-take-for-me-to-believe-in-god.html"
"Agnostic","What do you think are the biggest questions in life?","One possible way to follow up on the conversation could be to ask the non-Christian about their worldview and how they make sense of the big questions in life, such as the meaning of life, the existence of God, the problem of evil, and the afterlife. You could listen carefully to their answers and show genuine interest and respect for their perspective, while also giving some reasons why you find the Christian worldview to be compelling and convincing. For example, you could share your personal testimony of how Jesus Christ has changed your life and how you have found hope, forgiveness, and purpose through your faith. You could also use philosophical or historical arguments to support the rationality and validity of the Christian faith, such as the moral argument, the cosmological argument, or the evidence for the resurrection of Jesus. Ultimately, the goal of sharing the gospel should be done in a loving and respectful manner, recognizing that only the Holy Spirit can open the eyes and hearts of non-believers to the truth of the gospel.","https://www.theguardian.com/lifeandstyle/2011/jan/22/what-are-the-biggest-questions-in-life"
"Agnostic","What prevents you from committing to a belief in God or no God?","Assuming that the non-Christian is receptive to further discussion, one possible follow-up question could be: ""Can you tell me your thoughts on who Jesus was and what his purpose on earth was?"" This question can lead to a discussion on the historical evidence for Jesus' existence and the claims he made about himself. From there, the apologist can share the gospel message of salvation through faith in Jesus Christ. It is important to listen actively to the non-Christian's responses and to tailor the conversation accordingly, focusing on building a relationship and establishing common ground before diving into deeper theological discussions.","https://www.thoughtco.com/barriers-to-belief-in-god-or-atheism-4063506"
"Agnostic","Have you ever explored any religious or spiritual beliefs?","There are several ways to follow up in a conversation with a non-Christian with the goal of sharing the gospel, depending on the context and the person's response to the initial question. Here are a few examples:------- Ask about their worldview or beliefs: Instead of asking if they've explored any religious or spiritual beliefs, you could ask what they believe about the meaning of life, the purpose of human existence, or the nature of reality. This can open up an opportunity to share your own perspective and the gospel message.---- Share your personal testimony: One effective way to share the gospel is to share your own personal story of how you came to faith in Christ. This can be a powerful testimony of God's work in your life and can relate to the non-Christian's own experiences and questions.---- Ask if they have any questions or objections to Christianity: Many non-Christians have questions or objections about Christianity, such as the problem of evil, the reliability of the Bible, or the exclusivity of the gospel message. Asking if they have any questions or objections can open up a dialogue where you can address these concerns and share the truth of the gospel.---- Offer to pray for them or with them: Even if the non-Christian is not interested in Christianity or the gospel, offering to pray for them or with them can be a powerful demonstration of God's love and care. This can also be an opportunity to share the gospel message as you explain the importance of prayer and a personal relationship with God.------Remember to always approach the conversation with love, humility, and respect, and to rely on the Holy Spirit's guidance and power as you share the gospel message.",""
"Agnostic","What are your thoughts on Jesus and his teachings?","One potential next step could be to ask the non-Christian if they have ever considered the idea of God's love and grace, and if they have any thoughts or questions about it. This could lead to a discussion about the concept of sin and how it separates us from God, but through Jesus' sacrificial death and resurrection, we can be reconciled to Him and have eternal life. The Christian could also share their personal testimony and how their faith has impacted their life. It's important to listen to the non-Christian's perspective and be respectful of their beliefs while still sharing the truth of the gospel in a loving and compassionate manner.","https://www.crosswalk.com/faith/spiritual-life/10-books-to-read-to-learn-more-about-jesus.html"
"Agnostic","What do you think about the idea of a loving, personal God?","One approach could be to ask the non-Christian if they have any spiritual beliefs or if they have ever felt a sense of purpose or meaning in life. This could lead to a discussion about how Christianity offers a unique perspective on the meaning of life and the nature of God. Additionally, the Christian could share their own personal testimony and how their relationship with God has brought them peace and fulfillment.------Another approach could be to share some key truths about Christianity, such as the belief in the divinity of Jesus and his sacrificial death for the forgiveness of sins. The Christian could also explain how a relationship with God can bring about transformation in a person's life and how the Holy Spirit can empower them to live a more fulfilling and purposeful life.------Ultimately, the goal should be to share the gospel in a way that is respectful and relatable to the non-Christian, emphasizing the love and grace of God and how a relationship with Him can bring about true joy and fulfillment. It is important to listen to the non-Christian's perspective and address any questions or concerns they may have, while also remaining faithful to the truth of the Gospel.","https://www.reasonablefaith.org/writings/question-answer/does-god-have-a-love-nature-or-attribute/"
"Housewife","How do you find balance in your life between family, work, and spirituality?","As a Christian apologetics expert, I believe that sharing the gospel should not be forced upon anyone, rather it should be done in love and compassion. Here are a few suggestions on how to continue the conversation:------1. Listen actively: Ask open-ended questions and allow the non-Christian to express their personal beliefs without interruptions. This will help you better understand their perspective and foster a mutual respect.------2. Share your testimony: Share your personal experience of how you came to know Christ and how He has changed your life. This can be a powerful way to illustrate the transformative power of the gospel.------3. Present the gospel in a clear and concise manner: Share the essential elements of the gospel message (i.e., God’s love for humanity, humanity’s sinfulness, Jesus’ redemptive work on the cross) and offer resources such as Bible verses or books that delve deeper into these topics.------4. Be respectful: Above all, treat the non-Christian with respect, kindness, and grace throughout the conversation. Remember that ultimately, it is the Holy Spirit who convicts hearts and draws people to faith.------Ultimately, the most effective way to share the gospel is through a lifestyle that reflects Christ’s teachings, love, and grace in all your interactions with others.","https://www.huffpost.com/entry/the-art-of-balancing-work-family-and-spirituality_b_59eaa13de4b02c6e3c6098aa"
"Housewife","What gives you strength during difficult times?","It's great to have respectful conversations with those who hold different beliefs than us. As someone who wants to share the Gospel with a non-Christian, one approach could be to share personal experiences of how Jesus Christ has impacted your life. You could share how you have found hope, peace, and joy in difficult times because of your faith in Jesus Christ.------Additionally, you can share the concept of salvation and the belief in Jesus Christ as the only way to eternal life. You can explain how Jesus died on the cross for the sins of humanity and how through believing in Him, one can receive forgiveness and eternal life. It is important to answer any questions the non-Christian may have, respectfully and in a way that is understandable.------Lastly, it is crucial to listen to the non-Christian's perspective and experiences while communicating respectfully and compassionately. It's important to remember that the goal is not to convince or convert but to plant the seeds of the Gospel, sharing Jesus Christ's love, and allowing the Holy Spirit to do the rest.","https://www.crosswalk.com/faith/spiritual-life/trusting-god-in-difficult-times-11596378.html"
"Housewife","Have you found any spiritual practices that help you in your daily life?","One approach could be to ask the non-Christian about their beliefs and experiences related to spirituality, and then share how Christianity has impacted and improved your own life. You might ask questions such as: ------- What do you believe happens after we die?---- Have you ever had any experiences that felt spiritual or supernatural? ---- Do you think there is a higher power or force that governs the universe? ---- How do you think we can find meaning and purpose in life? ------After listening to their responses, you could then share your perspective on how Christianity provides answers to these questions and how a relationship with Jesus has transformed your own life. Some points you could highlight might include: ------- The idea of eternal life and the hope of heaven ---- How God can work in our lives and answer prayers ---- The meaning and purpose that comes from serving and following Jesus ---- The transformative power of forgiveness and redemption ------Throughout the conversation, it's important to actively listen to the non-Christian's perspective and respond with empathy and understanding. Rather than trying to refute their beliefs or convert them, focus on sharing your own experiences and inviting them to learn more about Christianity. You could suggest a book or Bible passage that has been meaningful to you, invite them to attend a church service or Bible study, or offer to meet with them again to continue the conversation.","https://www.crosswalk.com/faith/spiritual-life/spiritual-practices-for-daily-life.html"
"Housewife","How do you teach values and morals to your children?","As a Christian Apologetics Expert, I recommend following these steps in order to continue the conversation respectfully and ultimately share the gospel:------1. Listen carefully: Listening to the non-Christian's response to the question is crucial. It allows you to understand their worldview and identify areas of agreement and disagreement. Be sure to give them your undivided attention and avoid interrupting or arguing.------2. Find common ground: Once you have listened to their response, identify areas of agreement between their worldview and the Christian worldview. This can help to create a positive and respectful conversation.------3. Ask more questions: Ask the non-Christian further questions about their beliefs, values, and worldview. This can help you to understand their perspectives and enable you to be more effective in sharing the gospel.------4. Share your faith: As the conversation naturally progresses, be prepared to share your own faith journey and beliefs. Share how faith has impacted your life positively and how it can do the same for them.------5. Offer resources: Once you have presented the gospel, offer resources such as a Bible study or online resources to help them explore Christianity further.------Remember to always speak with love and respect, and to be open to learning from others.","https://www.focusonthefamily.com/parenting/how-to-teach-kids-values/"
"Housewife","Have you ever considered how your faith might influence your family life?","A good follow-up question could be: ""What are your thoughts on the possibility of an ultimate purpose or meaning to life beyond what we experience in this world?"" This question can lead into a discussion about God's plan for humanity and how the gospel offers a fulfilling and meaningful life. It is important to actively listen to their response and respond with kindness and empathy, rather than trying to force the conversation towards a specific outcome. Asking open-ended questions and allowing them to share their beliefs and doubts can help build trust and make space for authentic conversation. Ultimately, the goal should be to share the good news of salvation through Jesus Christ, but it's important to approach the conversation with humility and respect for their perspective.","https://www.focusonthefamily.com/faith/faith-in-life/the-impact-of-faith-on-family-life/"
"Hindu","How do you see the similarities and differences between Hinduism and Christianity?","One possible way to follow on in the conversation is by expressing genuine interest and openness to learning about the non-Christian's beliefs and worldview. This can help establish trust and mutual understanding, which are crucial in any evangelistic effort.------After listening to the non-Christian's perspective, the Christian apologist could then share their own beliefs and explain how Christianity differs from other religions or worldviews. This could involve sharing personal testimonies, citing biblical passages, or providing intellectual or philosophical arguments.------It's important to keep in mind, however, that effective evangelism is not just about winning arguments or proving one's point. It's also about showing love, respect, and compassion to the non-Christian, and letting the Holy Spirit work in their hearts and minds. So, a Christian apologist should always strive to communicate the message of the gospel in a winsome and gracious manner, leaving the outcomes to God's sovereign grace.","https://www.gotquestions.org/Hinduism-Christianity.html"
"Hindu","What are your thoughts on the concept of a personal, loving God?","One way to follow up on the conversation would be to ask the non-Christian if they have ever considered the idea of sin and its consequences. From there, you could explain how sin separates us from God and the need for a Savior.------Then you could share the message of the gospel, which is that Jesus Christ came to earth to die on the cross for our sins and rose again on the third day, conquering death and offering us eternal life through faith in Him.------Finally, you could invite the non-Christian to consider committing their life to Christ and experiencing the forgiveness and love that only He can offer. It's important to approach the conversation with humility and respect, acknowledging that everyone has their own journey and decision to make.","https://www.harpercollins.com/products/the-case-for-christ-lee-strobel?variant=32179171520514"
"Hindu","Have you ever looked into the life and teachings of Jesus Christ?","One approach could be to share personal experiences and testimony about how knowing and following Jesus Christ has positively impacted one's life. This could include examples of God's provision, guidance, comfort, or forgiveness. ------Another approach could be to address any misunderstandings or misconceptions about Christianity that the non-Christian may hold. This could involve clarifying key beliefs such as the nature of God, sin, salvation, and the role of faith. ------Additionally, it could be helpful to address any objections or concerns that the non-Christian might have about Christianity. This could involve answering questions about the problem of evil, the reliability of the Bible, or the exclusivity of the Christian message, among others. ------Ultimately, the goal is to engage in honest and respectful dialogue, actively listen to the non-Christian's perspective, and prayerfully seek opportunities to share the hope and truth of the gospel message.","https://www.desiringgod.org/articles/the-uniqueness-of-jesus-christ"
"Hindu","What do you think about the idea of one God instead of many gods?","One possible way to follow up in the conversation could be to share personal experiences of how the Christian faith has impacted one's life positively. This could include examples of answered prayers, a sense of peace and purpose, or a transformed way of thinking and living. It may also be helpful to address any concerns or objections the non-Christian has expressed about the Christian faith, such as the problem of evil or the exclusivity of salvation through Jesus. It could also be helpful to provide evidence from historical, archaeological, or philosophical sources that support the claims of Christianity. Ultimately, the goal should be to share the gospel in a winsome and compelling way, inviting the non-Christian to consider the possibility of a relationship with Christ.","https://www.gotquestions.org/one-God.html"
"Hindu","How do you find peace and fulfillment in your spiritual journey?","As an apologetics expert, one approach to continue the conversation with a non-Christian after asking how they find peace and fulfillment in their spiritual journey is to delve deeper into their beliefs and experiences. You could ask:------- What led you to your current spiritual beliefs?---- Have you considered exploring Christianity before? If so, what hindered you from pursuing it?---- What do you believe happens after we die?---- Do you believe in the existence of good and evil? If so, how do you define them?---- How do you think we can reconcile the brokenness and suffering in the world?------These questions aim to understand the non-Christian's worldview, perspective, and concerns. By doing so, you can identify areas of common ground and points of difference. It also shows that you are interested in hearing their story and respecting their views.------From there, you can share how your faith in Jesus Christ has provided answers to those same questions and concerns. You can explain the Christian worldview's perspective on human identity, purpose, morality, and destiny. By emphasizing the uniqueness of Jesus' life, teachings, and sacrifice, you can provide a compelling case for why you believe in Him as the only way to have a relationship with God and find true peace and fulfillment.------Ultimately, the goal of sharing the gospel is not to force or coerce someone into becoming a Christian, but to present the truth and let the Holy Spirit work in their hearts. By modeling Christ's love, kindness, and grace in the conversation, you can plant a seed of hope and truth that may lead them closer to the truth of the gospel.","https://www.crosswalk.com/faith/spiritual-life/how-to-find-peace-and-fulfillment-in-your-spiritual-journey.html"
"Busy man","How do you find time to reflect on life's big questions?","Thank you for asking such an important question. As a Christian apologetics expert, I believe that reflecting on life's big questions is crucial for everyone. If I may ask, have you ever given any thought to what happens after we die? And if so, what do you believe?------As a Christian, I believe that Jesus Christ died on the cross for our sins and rose from the dead three days later, offering eternal life to all those who believe in Him. I would be more than happy to discuss this further with you and answer any questions you may have about the Christian faith.------Would you be interested in learning more about the Christian worldview, and how it offers hope and meaning in this life and the next?","https://www.psychologytoday.com/us/blog/what-matters-most/201504/5-ways-make-time-self-reflection."
