"CATEGORY","QUESTION","ANSWER","LINK"
"Busy man","In the midst of your busy schedule, what gives you a sense of purpose?","Assuming that the non-Christian responded positively and showed interest in the conversation, a Christian apologetics expert might follow up with the following steps: ------1. Listen and understand their perspective: It is essential to listen to their perspective to understand their beliefs and where they are coming from. This will help you to identify any misconceptions or objections they may have about Christianity.------2. Address their objections: Once you understand their perspective, address their objections and explain how Christianity can answer their questions or address their concerns. It is important to do this respectfully and sensitively to avoid causing offense.------3. Share the Gospel: After addressing some of their objections, you can then share the Gospel with them. This involves explaining how God loves them, how sin separates us from God, and how Jesus sacrificially gave his life to reconcile us to God.------4. Invite them to consider Christianity: After presenting the Gospel, invite them to consider Christianity as a way of life. This involves explaining the benefits of following Jesus, such as eternal life, peace, and purpose.------5. Follow-up: Keep in touch with the non-Christian and offer to answer any more questions they may have. Continue to show them love and respect, regardless of whether they accept the Gospel or not.","https://www.psychologytoday.com/us/blog/intentional-insights/201703/5-ways-find-purpose-your-busy-life"
"Busy man","Have you ever considered exploring faith as a way to find balance and peace?","One potential follow-up question could be, ""What do you believe happens after we die?"" This can lead to a discussion about the possibility of an afterlife and the importance of understanding what happens to us spiritually.------Other potential questions could include asking about the non-Christian's perspective on the existence of God, their views on morality and ethics, or their thoughts on the purpose of life.------From there, the Christian apologetics expert can offer insights, arguments, and evidence to support their belief in Christianity and the importance of faith in addressing these profound questions. The goal should be to engage in a respectful, honest dialogue with the non-Christian and to help them see the value of exploring Christianity as a way of finding meaning, purpose, and peace in their lives.","https://www.christianitytoday.com/edstetzer/2019/october/exploring-faith-exploring-god.html"
"Busy man","What role does spirituality play in your life?","Understanding that spirituality is an important aspect of one's belief system and worldview, I would instead ask the non-Christian about their beliefs regarding the purpose and meaning of life. This can open up a dialogue about important existential questions that many people struggle with, regardless of their religious affiliation.------From there, I might share about how Christianity holds answers to these questions through the message of the gospel. I could share about the love and grace of God, the sacrifice of Jesus on the cross, and the hope of eternal life.------However, it's important to approach this conversation with sensitivity and respect, recognizing that the non-Christian may have deeply held beliefs and experiences that have led them to their current worldview. It's important to listen actively and respond with understanding, rather than trying to aggressively convert them. Ultimately, our goal should be to share the love of God and provide an opportunity for the non-Christian to explore Christianity further on their own terms.","https://www.psychologytoday.com/us/basics/spirituality"
"Busy man","Do you think there is more to life than just work and success?","One approach to continue the conversation and share the gospel could be to discuss the concept of sin and its effects on humanity. This can be done by pointing out that everyone falls short of certain standards and that this imperfection is a result of sin. God, being perfect, cannot tolerate sin and requires a payment for it. This is where Jesus Christ enters the picture, as his death and resurrection provide the payment for our sins, allowing us to have a restored relationship with God. From there, you can talk about accepting Jesus Christ as Lord and Savior, and the resulting benefits of a relationship with Him. It's important to keep the conversation respectful and open, allowing for any questions or objections the non-Christian may have.","https://www.crosswalk.com/faith/spiritual-life/is-there-more-to-life-than-success-and-achievements.html"
"Teenager","What do you think are the biggest challenges your generation faces?","One possible approach to follow up on this question and share the gospel could be:------1. Listen actively and empathetically to the non-Christian's response to understand their worldview and concerns.------2. Acknowledge common ground and points of agreement, such as the importance of kindness, love, and justice.------3. Share personal stories and testimonies of how one's faith has made a positive difference in one's life, relationships, and community.------4. Highlight key aspects of the gospel message, such as God's love, Jesus' sacrifice, and salvation through faith.------5. Be open to questions, doubts, and objections, and respond with grace, humility, and truth.------6. Invite the non-Christian to consider the claims of Jesus and the Bible, and to explore further by reading, praying, attending church, or talking to other Christians.------7. Respect the non-Christian's freedom to choose their own beliefs and values, and don't pressure or manipulate them into conversion or conformity.------8. Pray for the non-Christian, their well-being, and their spiritual journey, trusting that God is at work in their life and can reveal truth to them.","https://www.forbes.com/sites/ashleystahl/2019/07/01/5-challenges-facing-the-next-generation-of-leaders/?sh=6a562fe41983"
"Teenager","How do you form your beliefs and values?","One approach to follow up in a conversation with a non-Christian with the ultimate goal of sharing the gospel is to establish a common ground to communicate on. This could involve asking questions to gain insight into the non-Christian's worldview and experiences, actively listening to their responses, and looking for opportunities to connect their experiences with the message of the gospel.------For example, you could inquire about their views on life, purpose, and morality, and then share how Christianity addresses these fundamental questions. You could also share your own experiences of how Christianity has transformed your life and offer to share more about the hope and peace that comes from a personal relationship with Christ. It's important to keep in mind the non-Christian's perspective and not come across as judgmental or dismissive of their beliefs.------Additionally, you could recommend resources such as books, articles, or podcasts that provide more insight into Christianity and the gospel message. Ultimately, it's essential to approach the conversation with a spirit of love, respect, and genuine interest in the other person's well-being.","https://www.psychologytoday.com/us/blog/happiness-in-world/201204/how-do-we-develop-our-beliefs-and-values"
"Teenager","Have you ever explored spiritual or religious beliefs?","Assuming that the non-Christian has expressed some interest in hearing more about Christianity, here are some possible ways to continue the conversation with the goal of sharing the gospel:------1. Share your personal testimony: You could share how you came to believe in Jesus and how He has transformed your life. This could help the non-Christian understand the power of the gospel and how it can change their life too.------2. Explain the gospel in simple terms: You could explain the core message of Christianity, which is that Jesus died on the cross for our sins and rose again from the dead. You could emphasize that salvation is a free gift from God that we receive by faith.------3. Address objections: You could ask the non-Christian if they have any objections or questions about Christianity and try to address them. This could include questions about the existence of God, the problem of evil, or the reliability of the Bible.------4. Invite them to church or to read the Bible: You could invite the non-Christian to attend church with you or to read the Bible for themselves. This could help them see Christianity in action and deepen their understanding of the faith.------5. Pray for them: Regardless of their response to the conversation, you could pray for the non-Christian and ask God to work in their heart and bring them to faith in Jesus.","https://www.psychologytoday.com/us/blog/finding-purpose/201803/exploring-spiritual-and-religious-beliefs"
