"CATEGORY","QUESTION","ANSWER","LINK"
"Existence and Nature of God","What is the concept of the Trinity?"
"Existence and Nature of God","How can God be both just and merciful?"
"Existence and Nature of God","Why would an all-powerful God allow suffering?"
"Existence and Nature of God","How do Christians understand God's omnipresence?"
"Existence and Nature of God","What is the difference between God's general and special revelation?"
"Existence and Nature of God","Can God create a stone so heavy that He cannot lift it?"
"Existence and Nature of God","How does the Christian understanding of God differ from other religions?"
"Existence and Nature of God","What is the importance of God's attributes in Christian theology?"
"Existence and Nature of God","How do Christians reconcile God's love with the idea of hell?"
"Jesus Christ","Why do Christians believe Jesus is the Son of God?"
"Jesus Christ","What is the significance of the resurrection of Jesus?"
"Jesus Christ","How can Jesus be both God and man?"
"Jesus Christ","Why do Christians believe Jesus is the only way t salvation?"
"Jesus Christ","What is the importance of Jesus' miracles in the New Testament?"
"Jesus Christ","How do Christians understand the virgin birth of Jesus?"
"Jesus Christ","What is the meaning of Jesus' death on the cross?"
"Jesus Christ","What are the main events in Jesus' life and ministry?"
"Jesus Christ","How do Christians view Jesus' teachings on morality?"
"Jesus Christ","What role does Jesus play in the end times according to Christian eschatology?"
"The Bible","How do Christians understand the inspiration of the Bible?"
"The Bible","What is the difference between the Old and New Testaments?","The Old Testament and New Testament are both parts of the Christian Bible, but they differ in several significant ways.------Firstly, the Old Testament was written in Hebrew (with some portions in Aramaic), while the New Testament was written in Greek.------Secondly, the Old Testament mainly focuses on the history and religious teachings of the Jewish people, and includes 39 books. These books cover the creation of the world, the history of the Jewish people, their laws, poetry and wisdom literature, and prophecies.------In contrast, the New Testament focuses on the life and teachings of Jesus Christ and the early Christian church. There are 27 books in the New Testament, including the four Gospels (Matthew, Mark, Luke, and John), which tell the story of Jesus' life and teachings, as well as letters from early Christian leaders like Paul, Peter, and James.------Overall, the Old Testament provides a historical and religious foundation for Judaism and Christianity, while the New Testament primarily focuses on the teachings and message of Jesus Christ and the establishment of the Christian faith.","https://www.gotquestions.org/Old-New-Testament.html"
"The Bible","How do Christians interpret difficult or controversial passages in the Bible?","Christians interpret difficult or controversial passages in the Bible in a number of ways. Here are some common approaches:------1. Contextual Interpretation: Christians try to understand the context in which the passage was written by examining the historical, cultural, and theological background. This helps to understand the intended meaning behind the text.------2. Exegesis: Christians use the process of exegesis, which involves analyzing the text word by word, to determine the meaning behind the passage. This involves studying the original languages in which the passage was written.------3. Theological Interpretation: Christians examine the theological teachings of the Bible as a whole to help understand difficult passages. They apply the teachings of the Bible to difficult passages to gain a better understanding.------4. Appeal to Authority: Christians may appeal to the authority of respected theologians, pastors or scholars to help interpret difficult passages. They may consult commentaries or academic articles that provide deeper insight into the meaning of the text.------5. Prayer: Christians may pray for guidance and understanding when reading difficult passages, trusting that the Holy Spirit will help them understand the text.------Overall, Christians interpret difficult or controversial passages in the Bible with care, humility, and a desire to know and follow the truth.","https://www.thoughtco.com/how-to-interpret-difficult-bible-passages-700186"
"The Bible","Why are there different translations of the Bible?","There are different translations of the Bible for several reasons:------1) Language changes over time: The original texts of the Bible were written in Hebrew, Aramaic, and Greek. As language evolves over time, the meaning of words can change or become obsolete, making it necessary to update the translation for modern readers.------2) Interpretation and understanding: Different translators may have different interpretations of the original text and therefore translate it differently. Additionally, some parts of the Bible may be difficult to translate accurately, leading to differences in interpretation and translation.------3) Cultural context: The cultural context of the original writers and their audience can also influence the translation. For example, certain idioms or phrases may not have direct equivalents in another language or culture and must be translated in a way that conveys the intended meaning.------4) Denominational preferences: Some Bible translations are produced specifically for particular denominations, reflecting their distinctive beliefs and practices.------Overall, the goal of different translations of the Bible is to make the meaning of the text more accessible to different audiences, while retaining the integrity of the original message.","https://www.gotquestions.org/different-translations.html"
"The Bible","How do Christians view the historical accuracy of the Bible?","Christians hold a range of views on the historical accuracy of the Bible. However, many Christians believe that the Bible is historically accurate, particularly in regard to major events and people described in it. The historical accuracy of the Bible is supported by archaeological findings, the consistency of the biblical accounts with other historical records, and the reliability of the authors of the Bible.------Christians also believe that the Bible is inspired by God, and therefore, the historical accuracy of the Bible is essential to understanding God's message to humanity. However, some Christians may interpret the Bible's historical accounts in a less literal way, particularly when the language used is metaphorical. In summary, while there may be some differences in interpretation, Christians generally believe that the Bible is historically accurate and trust its message as God's inspired Word.","https://www.christianitytoday.com/ct/2014/december-web-only/how-should-we-think-about-bibles-historical-reliability.html"
"The Bible","What is the significance of prophecy in the Bible?","Prophecy in the Bible is significant in a number of ways. Firstly, it provides evidence of the Bible's divine inspiration, as only a truly omniscient God could reveal future events with such accuracy. Prophecy also serves to warn people of impending judgement or to offer hope and comfort in difficult times. It can also serve to authenticate the identity of Jesus as the Messiah, as many prophecies from the Old Testament were fulfilled in his life and ministry. Additionally, the fulfilment of prophecy over time further demonstrates the reliability and truth of the Bible. In summary, prophecy in the Bible is significant in validating the truth of the Bible, providing guidance and hope to believers, and authenticating the identity of Jesus as the promised Messiah.","https://www.gotquestions.org/importance-prophecy.html"
"The Bible","How do Christians approach the study of the Bible?","Christians approach the study of the Bible with a sense of reverence and respect for the book as the inspired and authoritative word of God. They typically engage in rigorous study of the text, seeking to understand its original historical and cultural contexts, linguistic nuances, and theological themes. In addition to personal study and reflection, Christians often participate in group Bible studies and attend church services where the Bible is regularly taught and preached. Prayer and meditation are also essential components of the Christian approach to Bible study, as believers seek God's guidance and illumination in their understanding of the text.","https://www.christianitytoday.com/edstetzer/2017/may/biblical-study-how-christians-should-approach-scripture.html"
"The Bible","What are the main themes and messages of the Bible?","As a Christian Apologetics Expert, I can say that the Bible consists of two main parts - the Old Testament and the New Testament, with each part conveying different themes and messages. However, there are several overarching themes and messages that run throughout the Bible, such as:------1. God's love and redemption plan for mankind---2. The humanity's fallen nature and need for salvation.---3. The importance of faith and obedience to God.---4. The power of prayer and trusting in God's sovereignty.---5. God's judgment and justice.---6. The value of community and living a moral life.---7. The promise of eternal life through Jesus Christ.------Overall, the message of the Bible is about God's love for humanity and His plan to redeem us through His son Jesus Christ. The Bible also emphasizes the importance of living a life of faith, obedience, and moral righteousness, while trusting in the sovereignty of God.","https://www.gotquestions.org/main-themes-messages-Bible.html"
"The Bible","How do Christians reconcile apparent contradictions in the Bible?","There are several approaches that Christians take to reconcile apparent contradictions in the Bible:------1. Contextual interpretation: Christians often approach apparent contradictions by examining the context in which the passages were written. This involves examining details such as the author, intended audience, language, culture, and historical background. This helps to provide a deeper understanding of the passage and there is a possibility that there may not be any contradiction, it was just a misunderstanding.------2. Harmonization: Another approach is to seek to harmonize the passages in question. This involves looking for ways to reconcile the seeming contradictions by interpreting the passages in light of each other. The attitude here is that every passage in the Bible is true, and therefore any apparent contradiction can be resolved with a deeper understanding.------3. Historical and cultural context: Similar to contextual interpretation, placing the passage in its historical and cultural context can help to provide a clearer picture of what was being conveyed. Studying the customs, traditions, and practices of the time period can reveal the cultural nuances that may be informing the language and message of the passage.------4. Acknowledge human limitations: Lastly, it is important to remember that the Bible was written by human authors who were limited by their own biases, experiences, and perspectives. Acknowledging the limitations of human creativity and the degree to which these authors were inspired by God can also help to explain apparent contradictions. ------In summary, Christians use a variety of approaches to reconcile apparent contradictions in the Bible, including contextual interpretation, harmonization, historical and cultural context, and acknowledging human limitations. The most important thing is to approach the Bible with an attitude of reverence and humility, and to trust that God's truth always prevails.","https://www.crossway.org/articles/how-do-christians-handle-apparent-contradictions-in-the-bible/"
"The Bible","How have the biblical texts been preserved over time?","The biblical texts have been preserved over time through a combination of methods, including oral transmission, written manuscripts, and careful copying and translation by scribes and scholars. The Old Testament was originally transmitted orally, with important stories and teachings passed down through generations by word of mouth. Later, these stories were written down and preserved on scrolls made of parchment or papyrus. ------The New Testament was written in Greek by the apostles and other early Christian leaders, and these texts were copied by scribes and circulated among the fledgling Christian communities. As time passed, these texts were translated into other languages, including Latin, Syriac, Coptic and Ethiopian.------Over the centuries, numerous copies of the biblical texts have been made, and careful comparison of these texts by scholars has allowed for the identification of errors and discrepancies. Modern technology has also provided new tools for preserving and studying the biblical texts, including digital imaging, computer analysis, and advanced scientific techniques for restoring damaged or deteriorating manuscripts.------Overall, the biblical texts have been preserved over time through the dedicated efforts of countless individuals and communities, and their enduring influence on world history and culture is a testament to their enduring power and importance.","https://www.thegospelcoalition.org/article/how-has-bible-been-preserved-over-time/"
"Salvation","What is the Christian understanding of salvation?","In Christian theology, salvation refers to the act of being saved or redeemed from sin and its consequences through faith in Jesus Christ. According to Christian beliefs, all human beings are born sinful and separated from God, and the only way to be reconciled to God is through faith in Jesus Christ, who died on the cross for the forgiveness of sins and rose from the dead to give believers eternal life.------Salvation is a free gift that is available to all people regardless of their race, gender, or social standing. To receive salvation, one must repent of their sins, believe in Jesus Christ as Lord and Savior, and commit to following him for the rest of their lives. This involves a personal relationship with God through prayer, reading and studying the Bible, and participating in the community of believers.------In summary, the Christian understanding of salvation is that it is a free gift of God available to all people through faith in Jesus Christ, and involves being reconciled to God and receiving eternal life.","https://www.crossway.org/articles/what-is-salvation/"
"Salvation","How do different Christian denominations view the process of salvation?","Different Christian denominations have varied views on the process of salvation. ------Some denominations believe in the concept of salvation through faith alone, known as sola fide. This belief emphasizes that salvation is achieved through faith in Jesus Christ alone, and good works or deeds are not necessary for salvation. Examples of denominations that believe in sola fide include Lutherans and Reformed Christians.------Other denominations place more emphasis on works or deeds, in addition to faith, as necessary for salvation. This belief emphasizes the importance of good works and discipleship in demonstrating one's faith and commitment to Christ. Examples of denominations that hold to this view include Catholics and Eastern Orthodox Christians.------There are also denominations that believe in a combination of both faith and works as necessary for salvation. These denominations emphasize the importance of both faith and good works in achieving salvation. Examples of denominations that hold to this view include Anglicans and Methodists.------Overall, while there are variations in belief among different Christian denominations, the ultimate goal is the same – to seek salvation and a relationship with God through faith in Jesus Christ.","https://www.christianitytoday.com/biblestudies/articles/theology/salvation-denominational-differences.html"
"Salvation","What is the role of faith and works in salvation?","As a Christian Apologetics Expert, I would say that both faith and works play a crucial role in salvation. According to the Bible, we are saved by grace through faith in Jesus Christ (Ephesians 2:8-9). This means that our faith in Jesus Christ as our Lord and Savior is the foundation of our salvation. However, our faith must be accompanied by works (James 2:14-26). Just as a tree is known by its fruit, our faith is known by our actions (Matthew 7:15-20). ------Works do not save us, but they are the evidence of our faith. If we are truly saved, we will do good works as a result of our faith. Good works include obeying God's commands, serving others, and sharing the gospel with others. ------In summary, both faith and works are necessary for our salvation. Faith is the foundation of our salvation, and works are the evidence of our faith. We cannot earn our salvation through works, but our works are the fruit of our faith and demonstrate our salvation.","https://www.desiringgod.org/articles/what-is-the-role-of-works-in-the-christian-life"
"Salvation","How do Christians understand the concept of original sin?","As a Christian Apologetics Expert, I can say that the concept of original sin is based on the idea that all humans are born with a sinful nature due to the actions of Adam and Eve in the Garden of Eden. Christians believe that when Adam and Eve disobeyed God's command, they introduced sin into the world, and this sin has been passed down through human generations ever since.------The idea of original sin is supported by biblical passages such as Romans 5:12-14, which states that sin entered the world through one man (Adam) and that death came to all people because of sin. Christians understand that original sin means that humans are inherently flawed and prone to sin. However, through faith in Jesus Christ, Christians believe that they can be saved from the consequences of sin and have eternal life with God.------Overall, the concept of original sin is central to Christian theology and plays a significant role in how Christians understand the nature of humanity and salvation.","https://www.thoughtco.com/original-sin-700766"
"Salvation","What is the meaning of grace in Christianity?","Grace in Christianity refers to the unmerited, undeserved, and freely given favor and love of God towards humanity. It is a gift of God's divine mercy and forgiveness, and it is received by faith through Jesus Christ. Christians believe that no one can earn grace through good works or personal merit, but it is given to us solely because of God's love for us. Grace empowers believers to live a righteous life and to pursue holiness in Christ, and it offers freedom from sin and the eternal consequences of sin. In short, grace is the cornerstone of the Christian faith and the foundation of our salvation in Christ.","https://www.gotquestions.org/grace-Christianity.html"
"Salvation","Can a person lose their salvation?","The question of whether a person can lose their salvation is a debated topic among Christians. Those who hold to the belief of ""once saved, always saved"" assert that once a person has genuinely received salvation through faith in Jesus Christ, they cannot lose it. However, others believe that it is possible for a person to lose their salvation if they fall away from their faith or continue in unrepentant sin. ------The Bible teaches that salvation is a gift of grace through faith in Jesus Christ, and it cannot be earned or lost by our own works (Ephesians 2:8-9). But it also describes the importance of continuing in faith and obedience (John 15:5-6, Hebrews 10:26-27).------Ultimately, the answer to this question depends on one's interpretation of scripture, and it is a matter of personal belief. However, Christians are called to continue in faith, obedience, and repentance and trust in the Lord's power to keep them saved.","https://www.christianity.com/wiki/salvation/can-a-person-lose-their-salvation.html."
"Salvation","What is the relationship between repentance and salvation?","Repentance and salvation are closely related concepts in the Christian faith. Repentance is the act of recognizing and turning away from one's sins, while salvation refers to the deliverance of a person from sin and its consequences. In other words, repentance is a necessary component of salvation.------In the Bible, repentance is often connected with salvation. In Acts 2:38, Peter said, ""Repent and be baptized, every one of you, in the name of Jesus Christ for the forgiveness of your sins. And you will receive the gift of the Holy Spirit."" This verse shows that repentance is a prerequisite for receiving forgiveness and the Holy Spirit, which are essential components of salvation.------Similarly, in Luke 13:3, Jesus said, ""Unless you repent, you too will all perish."" This statement emphasizes the importance of repentance in avoiding spiritual destruction.------Therefore, repentance is a necessary step towards salvation. Without recognizing and turning away from our sins, we cannot receive the forgiveness and deliverance from sin that salvation offers.","https://www.gotquestions.org/repentance-and-salvation.html"
"Salvation","How does the doctrine of predestination relate to salvation?","The doctrine of predestination is a somewhat controversial topic among Christians, but broadly speaking it refers to the idea that God has determined in advance which individuals will be saved and which will not. Advocates of this doctrine often argue that God's choice of who to save is based on his sovereign will rather than any merit or deservingness on the part of the individual. ------In terms of its relation to salvation, the doctrine of predestination suggests that salvation is not ultimately dependent on human efforts or accomplishments, but rather is a gift that is graciously bestowed by God according to his own purposes. This idea highlights the importance of faith in God and his saving power, as well as humility and trust in God's goodness and wisdom. ------At the same time, important questions and debates exist within Christian communities regarding how exactly the doctrine of predestination should be understood and applied. For some Christians, this idea can raise troubling questions about human freedom and responsibility, and can lead to disagreements about the nature of God's justice and mercy. Ultimately, however, many Christians see the doctrine of predestination as a way of affirming God's sovereignty, his boundless love for humanity, and his saving power.","https://www.thegospelcoalition.org/essay/predestination-salvation/"
"Salvation","What is the role of the Holy Spirit in a person's salvation?","As a Christian Apologetics Expert, I can say that the role of the Holy Spirit in a person's salvation is crucial. According to Christian theology, the Holy Spirit is the third person of the trinity and is responsible for convicting the sinner of their need for salvation. ------Without the work of the Holy Spirit in a person's heart, they will not recognize their sinfulness and their need for a Savior. The Holy Spirit also guides the believer in their daily walk with God and empowers them to live a righteous life. ------In addition, the Holy Spirit seals the believer until the day of redemption, ensuring that they will spend eternity with God. So, in summary, the Holy Spirit plays a vital role in a person's salvation by convicting, guiding, empowering, and sealing the believer in their faith journey.","https://www.gotquestions.org/Holy-Spirit-salvation.html"
"Salvation","What is the meaning of grace in Christianity?","In Christianity, grace refers to the unmerited and undeserved favor of God shown to mankind. It is a gift that God freely gives to us without condition or expectation of repayment. Grace is often described as God's love and mercy extended to all people regardless of their past, present, or future actions. It is through grace that a person is saved by faith in Jesus Christ, not by their own works or efforts. Grace is a central concept in the Christian faith and is the foundation of God's relationship with humanity.","https://www.christianity.com/wiki/jesus-christ/what-is-grace-definition-and-meaning.html"
"Salvation","Can a person lose their salvation?","As a Christian Apologetics Expert, I will say that the answer to this question is a matter of theological debate among Christians. Some Christians believe in the doctrine of ""eternal security,"" which teaches that once a person is truly saved, they cannot lose their salvation. Other Christians hold that it is possible for a person to reject their salvation and walk away from their faith, thus forfeiting their salvation.------The biblical support for both positions is complex and can be interpreted in different ways. However, it is clear from scripture that our salvation is a gift of grace that must be received by faith (Ephesians 2:8-9). We are also called to persevere in our faith and not turn away (Hebrews 10:39).------Ultimately, Christians should focus on living a life that honors God and seeks to grow in our relationship with Him, rather than worrying about whether or not we can lose our salvation. We can have confidence in our salvation by trusting in Jesus Christ and striving to follow Him faithfully.","https://www.christianity.com/wiki/salvation/can-a-christian-lose-their-salvation-common-interpretations-of-hebrews-6-4-6.html"
